{
  "id": "yi_sunsin",
  "name": "이순신",
  "born": 1545,
  "died": 1598,
  "deathType": "event",
  "sources": [
    "『전서』 권10 「시장」(을사년 3월 8일, 건천동)·「행장」(3월 8일 자시)",
    "권수 「세보」",
    "「행록」 무술년 11월 19일",
    "권수 「세보」·「연표」",
    "권10 「노량묘비」·「신도비」",
    "『선조실록』 선조 31년 11월 25일(명 측 게첩 인용)"
  ],
  "prologue": {
    "text": "1545년 3월 8일, 한성 건천동 집에서 당신이 태어난다. 같은 해 인종이 재위 8개월 만에 죽고 열두 살 명종이 즉위하며, 외척 윤원형이 을사사화를 일으킨다.",
    "sources": [
      "『전서』 권10 「시장」(을사년 3월 8일, 건천동)·「행장」(3월 8일 자시)",
      "권수 「세보」",
      "[한국민족문화대백과사전 「명종」](https://encykorea.aks.ac.kr/Article/E0018366)"
    ]
  },
  "traits": [
    {
      "id": "jin_play",
      "name": "진놀이 대장",
      "description": "어려서부터 아이들을 모아 진을 쳤다.",
      "statModifiers": {
        "leadership": 5
      }
    },
    {
      "id": "upright",
      "name": "강직",
      "description": "윗사람의 청이라도 옳지 않으면 거절한다.",
      "statModifiers": {
        "charisma": 5,
        "diplomacy": -5
      }
    },
    {
      "id": "turtle_ship",
      "name": "귀선",
      "description": "거북 모양의 전선을 거느린다."
    },
    {
      "id": "commander",
      "name": "삼도수군통제사",
      "description": "세 도의 수군을 거느린다."
    }
  ],
  "initialTraits": [
    {
      "id": "jin_play",
      "sources": [
        "『전서』 권10 「신도비」(김육)",
        "『선조실록』 선조 30년 1월 27일(권차 미확인)"
      ]
    }
  ]
}
